{
  "@context": [
    "https://www.w3.org/ns/credentials/v2",
    "https://rightsroot.org/spec/prm/ns/v1"
  ],
  "type": [
    "VerifiableCredential",
    "PRMDeliveryRecord"
  ],
  "noticeDigest": "uEiC5IVcL4rLIEItGi5JPCBeTyfp__1e7h9yL3Z_vJO3tRg",
  "policyDigest": "uEiCCVYqo5goptwm4lS1RN_8WgOwJ5A8un4JTasreIyS9JA",
  "recipient": {
    "name": "City of Whittier Police Department",
    "domain": "whittierpd.org",
    "contact": "13200 Penn St\nWhittier, CA 90602"
  },
  "method": "certified-mail",
  "deliveredAt": "2026-09-17T16:00:00Z",
  "recorded": "2026-09-17T17:00:00Z",
  "reference": "PLACEHOLDER-TRACKING-0000",
  "notes": "Certified mail, return receipt requested. Receipt retained privately.",
  "proof": {
    "type": "DataIntegrityProof",
    "cryptosuite": "eddsa-jcs-2022",
    "created": "2026-09-17T17:00:00Z",
    "verificationMethod": "did:key:z6MkfCwPTWq3SKbw4AVj7j8t8oFBiFp6CvZiTnXAw24nVkLH#z6MkfCwPTWq3SKbw4AVj7j8t8oFBiFp6CvZiTnXAw24nVkLH",
    "proofPurpose": "assertionMethod",
    "proofValue": "zcuQqAy8z8zE8yHth23vwiJPbUUQRGZVaTqpsSZYp6fwfcnVdfRif75NdetQUSDcXnWgDaz5yNgtEtdAoGx1UoYr"
  },
  "id": "urn:prm:delivery:uEiDlNIKixXUb-zlvksppHXRGyPnP47Itkcrq_kyIoxK7Yw"
}